{
  "document_count": 25,
  "documents": [
    {
      "content_type": "application/pdf",
      "document_id": "ACT-AADHAAR-ACT-2016-V001-75B5627B0C47",
      "file_path": "data/raw/ingestion/v1/artifacts/sha256/75/75b5627b0c47ca885365ff82379063f33de3fb4bcc6ce657c569e654f35454d4.pdf",
      "final_url": "https://www.indiacode.nic.in/indiacode/bitstream/123456789/21418/1/aadhaar_act_2016_as_amended.pdf",
      "previous_document_id": null,
      "publication_date": "2016",
      "publication_date_precision": "year_from_registered_instrument_title",
      "retrieved_at": "2026-10-08T09:30:00Z",
      "review_status": "HUMAN_REVIEW_PENDING",
      "schema_version": "1.0.0",
      "sha256": "75b5627b0c47ca885365ff82379063f33de3fb4bcc6ce657c569e654f35454d4",
      "source_id": "aadhaar-act-2016",
      "source_url": "https://www.indiacode.nic.in/indiacode/bitstream/123456789/21418/1/aadhaar_act_2016_as_amended.pdf",
      "stage_history": [
        "NEW_DOCUMENT",
        "DISCOVERED",
        "DOWNLOADED",
        "HASHED",
        "EXTRACTION_QUEUE",
        "HUMAN_REVIEW_PENDING"
      ],
      "status": "INGESTED",
      "version": 1,
      "workflow_status": "EXTRACTION_QUEUE"
    },
    {
      "content_type": "application/pdf",
      "document_id": "ACT-BHARATIYA-NAGARIK-SURAKSHA-SANHITA-2-V001-2E3727142069",
      "file_path": "data/raw/ingestion/v1/artifacts/sha256/2e/2e3727142069c08af5ba8c79959951c355e9384dabc9f1a31a97930a74a2e484.pdf",
      "final_url": "https://indiacode.gov.in/server/api/core/bitstreams/dab4cf5a-e218-4c87-b397-d6ddd11a2b80/content",
      "previous_document_id": null,
      "publication_date": "2023",
      "publication_date_precision": "year_from_registered_instrument_title",
      "retrieved_at": "2026-10-08T09:30:00Z",
      "review_status": "HUMAN_REVIEW_PENDING",
      "schema_version": "1.0.0",
      "sha256": "2e3727142069c08af5ba8c79959951c355e9384dabc9f1a31a97930a74a2e484",
      "source_id": "bharatiya-nagarik-suraksha-sanhita-2023",
      "source_url": "https://indiacode.gov.in/server/api/core/bitstreams/dab4cf5a-e218-4c87-b397-d6ddd11a2b80/content",
      "stage_history": [
        "NEW_DOCUMENT",
        "DISCOVERED",
        "DOWNLOADED",
        "HASHED",
        "EXTRACTION_QUEUE",
        "HUMAN_REVIEW_PENDING"
      ],
      "status": "INGESTED",
      "version": 1,
      "workflow_status": "EXTRACTION_QUEUE"
    },
    {
      "content_type": "application/pdf",
      "document_id": "ACT-BHARATIYA-NYAYA-SANHITA-2023-V001-D4449E9995B2",
      "file_path": "data/raw/ingestion/v1/artifacts/sha256/d4/d4449e9995b21fd52627811d08f9d21feda6a3678b7e5355b651242d152167f5.pdf",
      "final_url": "https://indiacode.gov.in/server/api/core/bitstreams/8007a80e-259b-429d-9ca4-1a2f474b5000/content",
      "previous_document_id": null,
      "publication_date": "2023",
      "publication_date_precision": "year_from_registered_instrument_title",
      "retrieved_at": "2026-10-08T09:30:00Z",
      "review_status": "HUMAN_REVIEW_PENDING",
      "schema_version": "1.0.0",
      "sha256": "d4449e9995b21fd52627811d08f9d21feda6a3678b7e5355b651242d152167f5",
      "source_id": "bharatiya-nyaya-sanhita-2023",
      "source_url": "https://indiacode.gov.in/server/api/core/bitstreams/8007a80e-259b-429d-9ca4-1a2f474b5000/content",
      "stage_history": [
        "NEW_DOCUMENT",
        "DISCOVERED",
        "DOWNLOADED",
        "HASHED",
        "EXTRACTION_QUEUE",
        "HUMAN_REVIEW_PENDING"
      ],
      "status": "INGESTED",
      "version": 1,
      "workflow_status": "EXTRACTION_QUEUE"
    },
    {
      "content_type": "application/pdf",
      "document_id": "ACT-BHARATIYA-SAKSHYA-ADHINIYAM-2023-V001-554B2B4AE3D9",
      "file_path": "data/raw/ingestion/v1/artifacts/sha256/55/554b2b4ae3d9f09bf31e6e1ba2b2cb8a4e7f4f5ffd6f3156736752cbbce116d5.pdf",
      "final_url": "https://indiacode.gov.in/server/api/core/bitstreams/fa0f7526-d871-41f2-a644-2a42952211f5/content",
      "previous_document_id": null,
      "publication_date": "2023",
      "publication_date_precision": "year_from_registered_instrument_title",
      "retrieved_at": "2026-10-08T09:30:00Z",
      "review_status": "HUMAN_REVIEW_PENDING",
      "schema_version": "1.0.0",
      "sha256": "554b2b4ae3d9f09bf31e6e1ba2b2cb8a4e7f4f5ffd6f3156736752cbbce116d5",
      "source_id": "bharatiya-sakshya-adhiniyam-2023",
      "source_url": "https://indiacode.gov.in/server/api/core/bitstreams/fa0f7526-d871-41f2-a644-2a42952211f5/content",
      "stage_history": [
        "NEW_DOCUMENT",
        "DISCOVERED",
        "DOWNLOADED",
        "HASHED",
        "EXTRACTION_QUEUE",
        "HUMAN_REVIEW_PENDING"
      ],
      "status": "INGESTED",
      "version": 1,
      "workflow_status": "EXTRACTION_QUEUE"
    },
    {
      "content_type": "application/pdf",
      "document_id": "ACT-CENTRAL-GOODS-SERVICES-TAX-ACT-2017-V001-C4DBD51F0355",
      "file_path": "data/raw/ingestion/v1/artifacts/sha256/c4/c4dbd51f0355360e63d8a25560547f9e7e00b3af349d8666265ab60b4610cf24.pdf",
      "final_url": "https://www.indiacode.nic.in/indiacode/bitstream/123456789/15689/1/A2017-12.pdf",
      "previous_document_id": null,
      "publication_date": "2017",
      "publication_date_precision": "year_from_registered_instrument_title",
      "retrieved_at": "2026-10-08T09:30:00Z",
      "review_status": "HUMAN_REVIEW_PENDING",
      "schema_version": "1.0.0",
      "sha256": "c4dbd51f0355360e63d8a25560547f9e7e00b3af349d8666265ab60b4610cf24",
      "source_id": "central-goods-services-tax-act-2017",
      "source_url": "https://www.indiacode.nic.in/indiacode/bitstream/123456789/15689/1/A2017-12.pdf",
      "stage_history": [
        "NEW_DOCUMENT",
        "DISCOVERED",
        "DOWNLOADED",
        "HASHED",
        "EXTRACTION_QUEUE",
        "HUMAN_REVIEW_PENDING"
      ],
      "status": "INGESTED",
      "version": 1,
      "workflow_status": "EXTRACTION_QUEUE"
    },
    {
      "content_type": "application/pdf",
      "document_id": "ACT-COMPANIES-ACT-2013-V001-D6E286D2A3FE",
      "file_path": "data/raw/ingestion/v1/artifacts/sha256/d6/d6e286d2a3feec89a7d432a5a572e91af9f0135411b03e57f72b7a8ef72139af.pdf",
      "final_url": "https://www.indiacode.nic.in/indiacode/bitstream/123456789/2114/5/A2013-18.pdf",
      "previous_document_id": null,
      "publication_date": "2013",
      "publication_date_precision": "year_from_registered_instrument_title",
      "retrieved_at": "2026-10-08T09:30:00Z",
      "review_status": "HUMAN_REVIEW_PENDING",
      "schema_version": "1.0.0",
      "sha256": "d6e286d2a3feec89a7d432a5a572e91af9f0135411b03e57f72b7a8ef72139af",
      "source_id": "companies-act-2013",
      "source_url": "https://www.indiacode.nic.in/indiacode/bitstream/123456789/2114/5/A2013-18.pdf",
      "stage_history": [
        "NEW_DOCUMENT",
        "DISCOVERED",
        "DOWNLOADED",
        "HASHED",
        "EXTRACTION_QUEUE",
        "HUMAN_REVIEW_PENDING"
      ],
      "status": "INGESTED",
      "version": 1,
      "workflow_status": "EXTRACTION_QUEUE"
    },
    {
      "content_type": "application/pdf",
      "document_id": "ACT-COMPETITION-ACT-2002-V001-374897436B4E",
      "file_path": "data/raw/ingestion/v1/artifacts/sha256/37/374897436b4edb2cef9ad2bb3f1b62ff667011260a514daf0dc152552f2d8f16.pdf",
      "final_url": "https://www.indiacode.nic.in/indiacode/bitstream/123456789/2010/7/A2003-12.pdf",
      "previous_document_id": null,
      "publication_date": "2002",
      "publication_date_precision": "year_from_registered_instrument_title",
      "retrieved_at": "2026-10-08T09:30:00Z",
      "review_status": "HUMAN_REVIEW_PENDING",
      "schema_version": "1.0.0",
      "sha256": "374897436b4edb2cef9ad2bb3f1b62ff667011260a514daf0dc152552f2d8f16",
      "source_id": "competition-act-2002",
      "source_url": "https://www.indiacode.nic.in/indiacode/bitstream/123456789/2010/7/A2003-12.pdf",
      "stage_history": [
        "NEW_DOCUMENT",
        "DISCOVERED",
        "DOWNLOADED",
        "HASHED",
        "EXTRACTION_QUEUE",
        "HUMAN_REVIEW_PENDING"
      ],
      "status": "INGESTED",
      "version": 1,
      "workflow_status": "EXTRACTION_QUEUE"
    },
    {
      "content_type": "application/pdf",
      "document_id": "ACT-CONSUMER-PROTECTION-ACT-2019-V001-414FB1EDD9B0",
      "file_path": "data/raw/ingestion/v1/artifacts/sha256/41/414fb1edd9b0f7fbc2839ad92fb2b29ebfa3b557e70e928ab4a535802199e3e7.pdf",
      "final_url": "https://www.indiacode.nic.in/indiacode/bitstream/123456789/15256/1/eng201935.pdf",
      "previous_document_id": null,
      "publication_date": "2019",
      "publication_date_precision": "year_from_registered_instrument_title",
      "retrieved_at": "2026-10-08T09:30:00Z",
      "review_status": "HUMAN_REVIEW_PENDING",
      "schema_version": "1.0.0",
      "sha256": "414fb1edd9b0f7fbc2839ad92fb2b29ebfa3b557e70e928ab4a535802199e3e7",
      "source_id": "consumer-protection-act-2019",
      "source_url": "https://www.indiacode.nic.in/indiacode/bitstream/123456789/15256/1/eng201935.pdf",
      "stage_history": [
        "NEW_DOCUMENT",
        "DISCOVERED",
        "DOWNLOADED",
        "HASHED",
        "EXTRACTION_QUEUE",
        "HUMAN_REVIEW_PENDING"
      ],
      "status": "INGESTED",
      "version": 1,
      "workflow_status": "EXTRACTION_QUEUE"
    },
    {
      "content_type": "application/pdf",
      "document_id": "ACT-COPYRIGHT-ACT-1957-V001-DA4144B68419",
      "file_path": "data/raw/ingestion/v1/artifacts/sha256/da/da4144b68419cf81bbf10979183ed1cf3fbe3795188995d1efc85fd7d65713bd.pdf",
      "final_url": "https://www.indiacode.nic.in/indiacode/bitstream/123456789/1367/1/A195714.pdf",
      "previous_document_id": null,
      "publication_date": "1957",
      "publication_date_precision": "year_from_registered_instrument_title",
      "retrieved_at": "2026-10-08T09:30:00Z",
      "review_status": "HUMAN_REVIEW_PENDING",
      "schema_version": "1.0.0",